{
  "build": {
    "timestamp_utc": "2026-08-23T08:18:39.979418Z"
  },
  "builder": {
    "implementation_sha256": "2799683119892af0aba7739f6c847dc3a432340fc263793ab54294473d00ebda",
    "name": "build_update_package.py",
    "runtime": "python",
    "runtime_version": "3.11.15",
    "version": "1.0.0"
  },
  "integrity": {
    "files": [
      {
        "executable": false,
        "path": "payload/NativeReasonUnitRuntime/Cargo.lock",
        "sha256": "bc6f14af6444570b05d6d9a09f38419f79c285cbb8179d2e77010901075b0ac1",
        "size_bytes": 4915
      },
      {
        "executable": false,
        "path": "payload/NativeReasonUnitRuntime/Cargo.toml",
        "sha256": "f4c84b61498b04122e619d831d68a13dc17012331db97c71fb6a227618b4e2c3",
        "size_bytes": 412
      },
      {
        "executable": false,
        "path": "payload/NativeReasonUnitRuntime/src/lib.rs",
        "sha256": "cd1904b5ccef83a10e9c800ce7c2a82454db8658b02044d947fa89022e3eae4e",
        "size_bytes": 43877
      },
      {
        "executable": false,
        "path": "payload/NativeReasonUnitRuntime/src/main.rs",
        "sha256": "4b993277c21a5751fb71c47caddd9c197729d4c2a028854c6e42488ae1394c99",
        "size_bytes": 6503
      },
      {
        "executable": false,
        "path": "payload/VERSION",
        "sha256": "c2d1deb3e4264181679f605092c7a87e78685b08c2238fef0f9cba51e59f7c2c",
        "size_bytes": 8
      },
      {
        "executable": false,
        "path": "payload/VisionRuntime/Cargo.lock",
        "sha256": "28a45f25cecfab8a3b81e2bdda4a93b5087f3eb9de98fb3d46c86137c3c410e4",
        "size_bytes": 4904
      },
      {
        "executable": false,
        "path": "payload/VisionRuntime/Cargo.toml",
        "sha256": "e496913f0e0ed745212ca21174a3e61061554ebaa3331da6b321de800fc1f2b5",
        "size_bytes": 339
      },
      {
        "executable": false,
        "path": "payload/VisionRuntime/src/lib.rs",
        "sha256": "19fea52d8664a4507d7b24cb9fd1cdbd45a706dfd539242b52b2ccd413954fde",
        "size_bytes": 30436
      },
      {
        "executable": false,
        "path": "payload/VisionRuntime/src/main.rs",
        "sha256": "1a5e65d00cf095b3e25d6b66d1bdbf47edeef6be60c5d1b4aa1ec2be54b34b67",
        "size_bytes": 3335
      },
      {
        "executable": false,
        "path": "payload/VisualizationRuntime/Cargo.lock",
        "sha256": "28eaad491f3ade49ff38323c1a08771f50f6e16095759be296fb934209dffb1a",
        "size_bytes": 5073
      },
      {
        "executable": false,
        "path": "payload/VisualizationRuntime/Cargo.toml",
        "sha256": "c19e6aefc8b088cbba8c913b6760e3d7471bda3252501cc376f1bdae800bf85a",
        "size_bytes": 437
      },
      {
        "executable": false,
        "path": "payload/VisualizationRuntime/src/lib.rs",
        "sha256": "b1b6a9c6233f8b523b87c9ca2ac72f3831b5f1205f6754b15e576c1631991ade",
        "size_bytes": 35140
      },
      {
        "executable": false,
        "path": "payload/VisualizationRuntime/src/main.rs",
        "sha256": "449f666eba7bcce8ae35d6ca990ae185990491311e64ae1326d24c07733fdb74",
        "size_bytes": 2867
      },
      {
        "executable": true,
        "path": "payload/bin/reason-runtime",
        "sha256": "21214536a0840019e0032d888504aa19b4373f4b7fbe2b4a3aada783f34728ce",
        "size_bytes": 185
      },
      {
        "executable": true,
        "path": "payload/bin/reason-updater",
        "sha256": "4780315c6e7791ebcfbf4766c3d1bc904c7628da59f2ff1e0441ba215a6f6039",
        "size_bytes": 3971584
      },
      {
        "executable": true,
        "path": "payload/bin/reason-vision",
        "sha256": "26a5448e9716d24e2b75d2d632a380871b365ae8b5733c2337d9b8cae6f818a9",
        "size_bytes": 1030640
      },
      {
        "executable": true,
        "path": "payload/bin/reason-visualization",
        "sha256": "d7aed9180473b1947f365e602f5e354dad5fbf9413861a18032c5a27cfff551d",
        "size_bytes": 1183992
      },
      {
        "executable": true,
        "path": "payload/bin/reasonunit-runtime-native",
        "sha256": "5db42857c00c4edb92b7f5508983f1e03986564f07c7702a87e5275eee4e19c2",
        "size_bytes": 981792
      },
      {
        "executable": false,
        "path": "payload/canonical_fixtures/phase1r/iterative_state_probe.rsn",
        "sha256": "449054c6a424e89d279d1b1a3139fed6d290193db14f76a51f7f843b0c366416",
        "size_bytes": 168
      },
      {
        "executable": false,
        "path": "payload/canonical_fixtures/phase1r/standalone_project/reason.toml",
        "sha256": "06fb86375f50bc854abd6dd52fb06ebdd22ac815fa104c917b0832d3fd3e81f2",
        "size_bytes": 126
      },
      {
        "executable": false,
        "path": "payload/canonical_fixtures/phase1r/standalone_project/src/main.rsn",
        "sha256": "a46ab60a435b22760c7513b0408431a0c5e7207efaeef91f4d824e67c17385cf",
        "size_bytes": 246
      },
      {
        "executable": false,
        "path": "payload/canonical_fixtures/phase1r/tensor_integration_probe.rsn",
        "sha256": "d1b4176f83d85a49058b04d86261ee86ef05758db09253f8e8076895cb411bbc",
        "size_bytes": 380
      },
      {
        "executable": false,
        "path": "payload/canonical_fixtures/phase1r/tensor_namespace_probe.rsn",
        "sha256": "a0cf1141e4c13a44e2b56f5d3214fcc4ea0bc04ec410dc9617f55e55207a735f",
        "size_bytes": 119
      },
      {
        "executable": false,
        "path": "payload/canonical_fixtures/vision_runtime/solar_observation.json",
        "sha256": "e5280e429a7a649549be36ec24ced2c931a6dd96417198c00eabd3352f393117",
        "size_bytes": 1168
      },
      {
        "executable": false,
        "path": "payload/canonical_fixtures/visualization_runtime/person_structure.json",
        "sha256": "a0c4610a55de27e67de9c5f36455110284b8fc71ab25a99ed5634a8b8e3f4a39",
        "size_bytes": 2382
      },
      {
        "executable": false,
        "path": "payload/conformance/README.md",
        "sha256": "8786bff2e7cbb208b0621caa6f09358c1c54f3c4510149bbbb7623c6d3ed3d04",
        "size_bytes": 1019
      },
      {
        "executable": false,
        "path": "payload/conformance/__init__.py",
        "sha256": "01ba4719c80b6fe911b091a7c05124b64eeece964e09c058ef8f9805daca546b",
        "size_bytes": 1
      },
      {
        "executable": false,
        "path": "payload/conformance/adapters/python_adapter.py",
        "sha256": "3344262646478954e7b63555477becbc116fb0a0577b7c6b43d452e2ef0eee85",
        "size_bytes": 482
      },
      {
        "executable": false,
        "path": "payload/conformance/adapters/typescript_adapter.ts",
        "sha256": "b35de70ba0c36b1e2f6a684d71c3ae80313bcb43cfe668a5034775587b2928a0",
        "size_bytes": 1074
      },
      {
        "executable": false,
        "path": "payload/conformance/certification/model.json",
        "sha256": "86aa5c22a6e1d81ba7cbb2d22a8ed8d0784b1aeb1c9913b8c9551713f00d7d4c",
        "size_bytes": 872
      },
      {
        "executable": false,
        "path": "payload/conformance/dto/README.md",
        "sha256": "0bc74f9a5514f7fc1eb159b34ef23a5477f1418ff52a7746d516a01b516f20d6",
        "size_bytes": 163
      },
      {
        "executable": false,
        "path": "payload/conformance/dto_conformance_tests/__init__.py",
        "sha256": "fc6df41456df74a358b799819d8ddb6f0dff137b94ef45b8902edeeac7bb138a",
        "size_bytes": 37
      },
      {
        "executable": false,
        "path": "payload/conformance/dto_conformance_tests/test_dto_conformance.py",
        "sha256": "c1d4df77650f02df51a5391cfade4597c39cb99461ec3e5fe29e915d4e8378ca",
        "size_bytes": 2216
      },
      {
        "executable": false,
        "path": "payload/conformance/dto_roundtrip_tests/__init__.py",
        "sha256": "01ba4719c80b6fe911b091a7c05124b64eeece964e09c058ef8f9805daca546b",
        "size_bytes": 1
      },
      {
        "executable": false,
        "path": "payload/conformance/dto_roundtrip_tests/test_python_dto.py",
        "sha256": "9fb39cc9804a3100c69d7c929738fda2b8dd395ca8323583a2bd176b4a840c44",
        "size_bytes": 3356
      },
      {
        "executable": false,
        "path": "payload/conformance/fixture_tests/__init__.py",
        "sha256": "01ba4719c80b6fe911b091a7c05124b64eeece964e09c058ef8f9805daca546b",
        "size_bytes": 1
      },
      {
        "executable": false,
        "path": "payload/conformance/fixture_tests/test_binding_shapes.py",
        "sha256": "a441d1d7d414e375a4207d015fa91fe7b27a4a0ad085c3cd65c029325b885c04",
        "size_bytes": 1767
      },
      {
        "executable": false,
        "path": "payload/conformance/fixtures/manifest.json",
        "sha256": "7cda3b16b5114951d02c0fd9a6906e0ca9cd78d9c94ab57271ba19d4e75ef162",
        "size_bytes": 1114
      },
      {
        "executable": false,
        "path": "payload/conformance/fixtures/transactions/basic_commit.json",
        "sha256": "c1d5ffe3b7e8757d05533fe09180f5921146a20f5f107385f150bd96f7e28565",
        "size_bytes": 469
      },
      {
        "executable": false,
        "path": "payload/conformance/fixtures/transactions/multiple_commit.json",
        "sha256": "7697d9e797bef1821d4318940ce67601061ca6a8fd89a4dae11656563d2924ca",
        "size_bytes": 730
      },
      {
        "executable": false,
        "path": "payload/conformance/fixtures/transactions/rollback.json",
        "sha256": "24d2f60a4bb6dbafdfd969c2a1edec75456a351c874325c524178fb320f0b37e",
        "size_bytes": 549
      },
      {
        "executable": false,
        "path": "payload/conformance/fixtures/transactions/trace_consistency.json",
        "sha256": "da8214917a43764ccdbda3344b5f0e8f513f0b9c6af8a9efddf2401449d5a35c",
        "size_bytes": 449
      },
      {
        "executable": false,
        "path": "payload/conformance/framework.py",
        "sha256": "6480da88da9db17a911c197ee32470d1be9f990e2752654c3cddc16202967379",
        "size_bytes": 10416
      },
      {
        "executable": false,